{
  "api_data_timestamp": "2026-08-31T09:00:04",
  "api_version": "2.0.5",
  "attempted_remainder_prefix_count": 10,
  "builder_code_commit": "7d5f731bc7411a368293c09158fa80205ca93955",
  "contract_id": "decomposition-test-remediation-047dd750572d6807",
  "contract_sha256": "047dd750572d680711bcd4755e81be9b88402e5c2cca9cd6736a2a0df61d38f5",
  "created_at": "2026-09-01T04:53:45.365865Z",
  "criterion_text_in_manifest": false,
  "current_filters_revalidated": true,
  "headless": true,
  "historical_source_hash_role": "provenance_only_not_current_acceptance",
  "imported_trial_count": 10,
  "records": [
    {
      "api_data_timestamp": "2026-08-31T09:00:04",
      "api_version": "2.0.5",
      "criterion_count": 17,
      "criterion_type_counts": {
        "exclusion": 11,
        "inclusion": 6
      },
      "current_filters_revalidated": true,
      "eligibility_sha256": "e5c029614c0daa79b1b08114c5f8c73fc2429a397c8f8e1c1efa128eabd522a5",
      "fetched_source_study_sha256": "02056a052b64e9d344f0caf2dbd4509e0d842acf13afe288199060cfc5dcb336",
      "frozen_source_study_sha256": "5e57a0250d3037ae76d9f58939610d28f42d86d7655de2f63ef5eef6b9c32f06",
      "historical_source_hash_match": false,
      "last_update_posted": "2025-09-22",
      "nct_id": "NCT05829317",
      "protocol_file_sha256": "bdff1c7bf91350018212fd6dbb6f3f12f098874692a8791a4964ec77036c4bdc",
      "protocol_path": "protocols/NCT05829317.json",
      "protocol_sha256": "b76ded638e8cb7060187d0b842f9d0c11a1321280c0dda607588c161bdbd1391",
      "raw_path": "raw/NCT05829317.json",
      "raw_sha256": "2975029c0dd658340002f854b3f4055108287666c8e329185e11d87a404ca144",
      "reason_code": null,
      "remainder_rank": 1,
      "sampling_hash": "0f2fb6a008d44f970732a5f0489201d5eff9a245b63678a4fc6697990e65db2d",
      "source_record_version": "2025-09-22:e5c029614c0d",
      "source_span_lengths": [
        14,
        14,
        24,
        27,
        30,
        33,
        37,
        44,
        48,
        51,
        53,
        53,
        72,
        76,
        76,
        157,
        201
      ],
      "status": "imported"
    },
    {
      "api_data_timestamp": "2026-08-31T09:00:04",
      "api_version": "2.0.5",
      "criterion_count": 6,
      "criterion_type_counts": {
        "exclusion": 4,
        "inclusion": 2
      },
      "current_filters_revalidated": true,
      "eligibility_sha256": "c2cbc41e831f861405dcdbbed6a9f40b668365915bf52b09310d88595a5dcbca",
      "fetched_source_study_sha256": "cb8d55b32d8c386a6cea5552389b205cad720154e4bb829c1164abf2cfcf34be",
      "frozen_source_study_sha256": "c4d1e1c053f8d494f518260315feb2a6fc970cbd34d3ddc96e22d709da66f5d2",
      "historical_source_hash_match": false,
      "last_update_posted": "2025-05-16",
      "nct_id": "NCT06330480",
      "protocol_file_sha256": "b794ddd9ed71ce406ea9bb2e83ff0972ecbea72089fe11981e2b489dbae6a048",
      "protocol_path": "protocols/NCT06330480.json",
      "protocol_sha256": "025b82ada4b9fb73948022bca36c99b56c83d8e6e476b431965a577cedf99e21",
      "raw_path": "raw/NCT06330480.json",
      "raw_sha256": "74e367e003082b47bd1e5434fd8b1ff46fc68ac837a9a87ef54fa7ba66daf3f8",
      "reason_code": null,
      "remainder_rank": 2,
      "sampling_hash": "0f712ca882aa1780f937eff0f24686c99b4c4d6052efe2c37fa197231e877d9a",
      "source_record_version": "2025-05-16:c2cbc41e831f",
      "source_span_lengths": [
        28,
        28,
        66,
        70,
        103,
        142
      ],
      "status": "imported"
    },
    {
      "api_data_timestamp": "2026-08-31T09:00:04",
      "api_version": "2.0.5",
      "criterion_count": 17,
      "criterion_type_counts": {
        "exclusion": 14,
        "inclusion": 3
      },
      "current_filters_revalidated": true,
      "eligibility_sha256": "204c710f7ebb24e4e1386e9d974f01cbfa3bb2d4c3a26de63199ffe41d5f4026",
      "fetched_source_study_sha256": "bfe96c32f38ea5936924a3320240af2b879bf775bf9ac1015702db9923520318",
      "frozen_source_study_sha256": "9af3a9587f75dcb913ece4a2f1ebc141bdfe5fea874a2a544ecc6dfb64389d87",
      "historical_source_hash_match": false,
      "last_update_posted": "2026-07-08",
      "nct_id": "NCT06279793",
      "protocol_file_sha256": "e5b73054038fdf716b9b7509ae1e5951f2cf7e1b1d3d9a2240a534c7e9892e7e",
      "protocol_path": "protocols/NCT06279793.json",
      "protocol_sha256": "f71d517bb10a1b55cbb17378b526793eaecf5571509227662d934924313dd399",
      "raw_path": "raw/NCT06279793.json",
      "raw_sha256": "7dc126ffd3902bce654f6531bb883a6c49807d95a371e29a7c7880a880dbbc6f",
      "reason_code": null,
      "remainder_rank": 3,
      "sampling_hash": "10562221c495a1980d3558d35c827d7c42aa97c8a0c59e829f2cb8c93bd6a88b",
      "source_record_version": "2026-07-08:204c710f7ebb",
      "source_span_lengths": [
        27,
        29,
        33,
        50,
        53,
        55,
        63,
        64,
        72,
        73,
        77,
        93,
        131,
        152,
        166,
        170,
        723
      ],
      "status": "imported"
    },
    {
      "api_data_timestamp": "2026-08-31T09:00:04",
      "api_version": "2.0.5",
      "criterion_count": 11,
      "criterion_type_counts": {
        "exclusion": 7,
        "inclusion": 4
      },
      "current_filters_revalidated": true,
      "eligibility_sha256": "1e7af82871bf9f35272124a312343fa90159e96bcb2acbff26b7abf7ab6d9294",
      "fetched_source_study_sha256": "211435baa150c0985e7c864e578dcf0c31cd62d14161c1746d4c91c9c15bfb81",
      "frozen_source_study_sha256": "27c49b091a6f94673d9a14c96ba9940f11547a915196fa9553b6520156679972",
      "historical_source_hash_match": false,
      "last_update_posted": "2026-04-13",
      "nct_id": "NCT07521800",
      "protocol_file_sha256": "0763827c09632d3fd796c4740cc48056b2fbf38c0eb62b4613c4b6b18ed84e81",
      "protocol_path": "protocols/NCT07521800.json",
      "protocol_sha256": "01df39d12e612b36feb1d218b1004ecfd8cb3db2dfb4f50f4ebd4332a38c1e85",
      "raw_path": "raw/NCT07521800.json",
      "raw_sha256": "ca9b7ffce9a14cb1d2514207ceaac7c700628738d48ac248e8795b00217f9717",
      "reason_code": null,
      "remainder_rank": 4,
      "sampling_hash": "10b9207201e4f8e50351a13d00f4f56d463540e99340e7202074f8a69d544247",
      "source_record_version": "2026-04-13:1e7af82871bf",
      "source_span_lengths": [
        22,
        29,
        33,
        44,
        48,
        59,
        62,
        70,
        83,
        104,
        129
      ],
      "status": "imported"
    },
    {
      "api_data_timestamp": "2026-08-31T09:00:04",
      "api_version": "2.0.5",
      "criterion_count": 10,
      "criterion_type_counts": {
        "exclusion": 6,
        "inclusion": 4
      },
      "current_filters_revalidated": true,
      "eligibility_sha256": "c4c23270d9061fd5702bd929d07822b352c302ef3f8ef52c0d05b8d3dc46339d",
      "fetched_source_study_sha256": "324c7636a90d0c7eab56a116cc8b907ec1ae5bfac6d098a8acf0eb506983cf87",
      "frozen_source_study_sha256": "ee34a88094f60613f463be2b0e04dbe9f380c184cc6f43cc9855bc0e62e6ddb2",
      "historical_source_hash_match": false,
      "last_update_posted": "2026-06-01",
      "nct_id": "NCT07616414",
      "protocol_file_sha256": "8ddf89d6516306c7b0c708c18128dfd46e0069260b241830a3f9f5bc5f7991cc",
      "protocol_path": "protocols/NCT07616414.json",
      "protocol_sha256": "4f29a0b245181ab8281c760f5d34bb2823cc335eec31fb098210acc337a86e6b",
      "raw_path": "raw/NCT07616414.json",
      "raw_sha256": "5275a8fd012c687613a2b9ca0e09b88f5a993d82e02e36e0b0e7a9a79c2c03ca",
      "reason_code": null,
      "remainder_rank": 5,
      "sampling_hash": "111443f9595a2887f60f137015554f9c76caec4e0707f7d87b8b5247e7f6c607",
      "source_record_version": "2026-06-01:c4c23270d906",
      "source_span_lengths": [
        10,
        25,
        50,
        72,
        75,
        78,
        94,
        99,
        195,
        196
      ],
      "status": "imported"
    },
    {
      "api_data_timestamp": "2026-08-31T09:00:04",
      "api_version": "2.0.5",
      "criterion_count": 43,
      "criterion_type_counts": {
        "exclusion": 32,
        "inclusion": 11
      },
      "current_filters_revalidated": true,
      "eligibility_sha256": "7b6c42fd7f6009507ca3f813a0afbded40ce4e0065c41698b89da3e60fe32558",
      "fetched_source_study_sha256": "3854c46efaa08c53e1458b8c42ec558e75c21bf762379db115b0fb09a223835f",
      "frozen_source_study_sha256": "341e99fef529e7c7b4f8b6e2d35fac1728b0f41c3845facb65c2ecd9a0b9f679",
      "historical_source_hash_match": false,
      "last_update_posted": "2026-08-25",
      "nct_id": "NCT05836987",
      "protocol_file_sha256": "4b295571fca309e2ac676e81d934d189e339b513f58cc915cc13140105eeb84f",
      "protocol_path": "protocols/NCT05836987.json",
      "protocol_sha256": "69f977dcde91b3af2d03375cbe7868bff62789ff0ea1099a840d31d41768b130",
      "raw_path": "raw/NCT05836987.json",
      "raw_sha256": "b7537e9db46d760479d944f48c3943954f149608798886f79151593d376fbec5",
      "reason_code": null,
      "remainder_rank": 6,
      "sampling_hash": "1152642154bb75e7fd1461d5c5445e07fb564c129b9d13b962b86e35a911ba16",
      "source_record_version": "2026-08-25:7b6c42fd7f60",
      "source_span_lengths": [
        19,
        28,
        35,
        36,
        36,
        41,
        42,
        42,
        45,
        54,
        55,
        56,
        57,
        60,
        64,
        65,
        69,
        71,
        73,
        78,
        79,
        81,
        93,
        101,
        102,
        104,
        105,
        113,
        116,
        116,
        124,
        126,
        135,
        142,
        149,
        149,
        168,
        235,
        310,
        348,
        351,
        368,
        891
      ],
      "status": "imported"
    },
    {
      "api_data_timestamp": "2026-08-31T09:00:04",
      "api_version": "2.0.5",
      "criterion_count": 16,
      "criterion_type_counts": {
        "exclusion": 11,